ID,Author(s),Title,Year,Type,Journal / Conference / Report,Publisher,Country of Origin,Targets,Target Class,Author Affiliation,Funding Organization,Copy of previous
137,G. L. Matloff,Saturn Titan Rendezvous a Solar-Sail Aerocapture Mission,2004,Conference,International Astronautical Congress,AIAA,USA,Titan,Titan,NYC College of Technology,NASA,N
138,R. E. Dyke,Structural Design for a Neptune Aerocapture Mission,2004,Conference,Atmospheric Flight Mechanics Conference,AIAA,USA,Neptune,Neptune,NASA Langley Research Center,NASA,N
139,M. J. Wright,The Impact of Flowfield-Radiation Coupling on Aeroheating for Titan Aerocapture,2004,Conference,Aerospace Sciences Meeting,AIAA,USA,Titan,Titan,NASA Ames Research Center,NASA,N
140,C. Cazaux,The NASA-CNES Mars sample returnтАФa status report,2004,Journal,Acta Astronautica,Elsevier,USA,Mars,Mars,Centre National d'Etudes Spatiales,NASA,N
141,W. R. Johnson,Titan Ballute Aerocapture Using a Perturbed TitanGRAM Model,2004,Conference,Atmospheric Flight Mechanics Conference,AIAA,USA,Titan,Titan,Jet Propulsion Lab,NASA,N
142,B. Laub,TPS Challenges for Neptune Aerocapture,2004,Conference,Atmospheric Flight Mechanics Conference,AIAA,USA,Neptune,Neptune,NASA Ames Research Center,NASA,N
143,D. Vaughan,A Comparative Study of Aerocapture Missions with a Mars Destination,2005,Conference,AIAA/ASME/SAE/ASEE Joint Propulsion Conference,AIAA,USA,Mars,Mars,Gray Research Inc.,NASA,N
144,B. R Starr,Aerocapture Performance Analysis of a Venus Exploration,2005,Conference,Atmospheric Flight Mechanics Conference,AIAA,USA,Venus,Venus,NASA Langley Research Center,NASA,N
145,A. S. Keys,Aerocapture Technologies - ISPT Program,2005,Report,NASA TM,NASA,USA,Venus, Earth, Mars, Titan, Neptune,Generic,NASA Marshall Space Flight Center,NASA,N
146,J. E. Johnson,Aerodynamic Stability of Re-Entry Heat Shield Shapes for a Crew Exploration Vehicle,2005,Conference,AIAA/ASME/SAE/ASEE Joint Propulsion Conference,AIAA,USA,Earth,Earth,University of Maryland, College Park,NASA,N
147,D. J. Rasky,A New Perepsective On NASAтАЩs Space Transportation Needs,2005,Conference,Space Exploration Conference,AIAA,USA,Generic,Generic,NASA Ames Research Center,NASA,N
148,T. K. Percy,Assessing the Relative Risk of Aerocapture Using Probabilistic Risk Assessment,2005,Conference,AIAA/ASME/SAE/ASEE Joint Propulsion Conference,AIAA,USA,Mars,Mars,Science Applications Inc.,NASA,N
149,C. G. Justus,Atmospheric Models for Mars Aerocapture -,2005,Conference,AIAA/ASME/SAE/ASEE Joint Propulsion Conference,AIAA,USA,Mars,Mars,NASA Marshall Space Flight Center,NASA,N
150,R. Y. Jits,Closed-Loop Trajectory Simulation for Thermal Protection System Design for Neptune Aerocapture,2005,Journal,Journal of Spacecraft and Rockets,AIAA,USA,Neptune,Neptune,NASA Ames Research Center,NA,N
151,C. G. Justus,Connecting atmospheric science and atmospheric models for aerocapture at Titan and the outer planets,2005,Journal,Planetary and Space Science,Elsevier,USA,Titan, Uranus, Neptune,Generic,NASA Marshall Space Flight Center,NASA,N
152,J. L. Hall,CostтАУBenefit Analysis of the Aerocapture Mission Set,2005,Journal,Journal of Spacecraft and Rockets,AIAA,USA,Venus, Earth, Mars, Titan, Neptune,Generic,Jet Propulsion Lab,NASA,Y
153,Z. R. Putnam,Entry System Options for Human Return from the Moon,2005,Conference,Atmospheric Flight Mechanics Conference,AIAA,USA,Earth,Earth,Georgia Institute of Technology,NASA,N
154,K. Skokova,Experimental Evaluation of Thermal Protection Materials for Titan Aerocapture,2005,Conference,AIAA/ASME/SAE/ASEE Joint Propulsion Conference,AIAA,USA,Titan,Titan,ELORET Corporation,NASA,N
155,A. L. Duvall,Global Reference Atmospheric Model (GRAM) Series for Aeroassist Applications,2005,Conference,Aerospace Sciences Meeting,AIAA,USA,Venus, Earth, Mars, Titan, Neptune,Generic,NASA Marshall Space Flight Center,NA,N
156,M. J. Wright,Impact of FlowfieldтАУRadiation Coupling on Aeroheating for Titan Aerocapture,2005,Journal,Journal of Thermophysics and Heat Transfer,AIAA,USA,Titan,Titan,NASA Ames Research Center,NA,Y
157,G. J. Brown,Minimum-Mass Design for Titan Aerocapture,2005,Conference,AIAA Aerodynamic Decelerator Systems Technology Conference,AIAA,USA,Titan,Titan,Vertigo Inc.,NASA,N
158,L. S. Colby,Nuclear Gas Turbine Propulsion System for a Long Endurance Titan Aerial Vehicle,2005,Conference,AIAA/ASME/SAE/ASEE Joint Propulsion Conference,AIAA,USA,Titan,Titan,Georgia Institute of Technology,NA,N
159,S. Craig,Parametric Study of Aerocapture for Missions to Venus,2005,Journal,Journal of Spacecraft and Rockets,AIAA,USA,Venus,Venus,University of Tennessee, Knoxville,NA,Y
160,E. H. Richardson,Review of NASA In-Space Propulsion Technology Program Inflatable Decelerator Investments,2005,Conference,AIAA Aerodynamic Decelerator Systems Technology Conference,AIAA,USA,Venus, Earth, Mars, Titan, Neptune,Generic,NASA Marshall Space Flight Center,NASA,N
161,T. Spilker,Significant science at Titan and Neptune from aerocaptured missions,2005,Journal,Planetary and Space Science,Elsevier,USA,Titan, Neptune,Generic,Jet Propulsion Lab,NASA,N
162,M. Kumar,Trajectory and Attitude Simulation for Aerocapture and Aerobraking,2005,Journal,Journal of Spacecraft and Rockets,AIAA,India,Earth,Earth,Indian Institute of Technology, Kanpur,NA,N
163,M. K. Lockwood,Aerocapture Systems Analysis for a Neptune Mission,2006,Report,NASA TM,NASA,USA,Neptune,Neptune,NASA Langley Research Center,NASA,Y
164,M. K. Lockwood,Aerocapture Systems Analysis for a Titan Mission,2006,Report,NASA TM,NASA,USA,Titan,Titan,NASA Langley Research Center,NASA,Y
165,K. L. Gates,Analytic Solutions for Aerocapture, Descent, and Landing Trajectories for Dual-Use Ballute Systems,2006,Conference,AIAA/AAS Astrodynamics Conference,AIAA,USA,Earth, Mars, Titan, Neptune,Generic,Purdue University,NASA,N
166,B. B. Donahue,Chemical and Solar-Electric-Propulsion Systems Analysis for Mars Sample Return Missions,2006,Journal,Journal of Spacecraft and Rockets,AIAA,USA,Mars,Mars,Boeing Defense and Space,NASA,N
167,S. A. Whitmore,Direct-Entry, Aerobraking, and Lifting Aerocapture for Human-Rated Lunar Return Vehicles,2006,Conference,Aerospace Sciences Meeting,AIAA,USA,Earth,Earth,Utah State Univeristy,NA,N
168,A. M. Brandis,Expansion Tube Operating Conditions for Studying Nonequilibrium Radiation Relevant to Titan Aerocapture,2006,Conference,AIAA/ASME/SAE/ASEE Joint Propulsion Conference,AIAA,Australia,Titan,Titan,University of Queensland,NA,N
169,J. Hamel,Improvement to the Analytical Predictor-Corrector Guidance Applied to Mars Aerocapture,2006,Journal,Journal of Guidance, Control and Dynamics,AIAA,Canada,Mars,Mars,University of Sherbooke,CSA,N
170,L. Johnson,In-Space Propulsion Technologies for Robotic Exploration of the Solar System,2006,Conference,AIAA/ASME/SAE/ASEE Joint Propulsion Conference,AIAA,USA,Venus, Earth, Mars, Titan, Neptune,Generic,NASA Marshall Space Flight Center,NASA,N
171,C. Tanner,On-Orbit Propellant Resupply Options for Mars Exploration Architectures,2006,Conference,International Astronautical Congress,AIAA,USA,Mars,Mars,Georgia Institute of Technology,NA,N
172,A. S. Keys,Overview of a Proposed Flight Validation of Aerocapture System Technology for Planetary Missions,2006,Conference,AIAA/ASME/SAE/ASEE Joint Propulsion Conference,AIAA,USA,Earth,Earth,NASA Marshall Space Flight Center,NASA,N
173,S. Aso,Preliminary studies on the planetary entry to Jupiter by aerocapture,2006,Journal,Acta Astronautica,Elsevier,USA,Jupiter,Jupiter,Kyushu University,NA,N
174,J. A. Christian,Sizing of an Entry, Descent, and Landing System for Human Mars Exploration,2006,Conference,AIAA Space,AIAA,USA,Mars,Mars,Georgia Institute of Technology,NA,N
175,M. K. Lockwood,Systems Analysis for a Venus Aerocapture Mission,2006,Report,NASA TM,NASA,USA,Venus,Venus,NASA Langley Research Center,NASA,Y
176,G. M. Buck,Testing of Flexible Ballutes in Hypersonic Wind Tunnels for Planetary Aerocapture,2006,Conference,Aerospace Sciences Meeting,AIAA,USA,Generic,Generic,NASA Langley Research Center,NASA,N
177,J. Esper,The Neptune-Triton Explorer mission - A concept feasibility study,2006,Journal,Acta Astronautica,Elsevier,USA,Neptune,Neptune,NASA Goddard Space Flight Center,NA,N
178,J. S. Robinson,Trajectory and Aeroheating Environment Development and Sensitivity Analysis for Capsule-Shaped Vehicles,2006,Conference,Space Planes and Hypersonic Systems and Technologies Conference,AIAA,USA,Earth,Earth,NASA Langley Research Center,NA,N
179,M. Kumar,Trajectory and Attitude Simulation for Mars Aerocapture and Aerobraking,2006,Journal,Journal of Spacecraft and Rockets,AIAA,USA,Mars,Mars,Texas A&M University,NA,N
180,G. Artis,Aerocapture Benefits to Future Science Missions to Venus, Titan,2007,Report,NASA TM,NASA,USA,Generic,Generic,NASA Marshall Space Flight Center,NASA,N
181,NASA,Aerocapture Fact Sheet,2007,Report,NASA TM,NASA,USA,Generic,Generic,NASA Glenn Research Center,NASA,N
182,S. Rezza,Aerocapture Inflatable Decelerator (AID) for Planetary Entry,2007,Conference,AIAA Aerodynamic Decelerator Systems Technology Conference,AIAA,USA,Titan,Titan,Lockeed Martin,NASA,N
183,B. A. Andersen,Aerodynamic Control on a Lunar Return Capsule using Trim-Flaps,2007,Conference,Aerospace Sciences Meeting,AIAA,USA,Generic,Generic,Utah State Univeristy,NA,N
184,R. R. Rohrschneider,Aeroelastic Design Considerations of a Clamped Ballute for Titan Aerocapture,2007,Conference,AIAA/ASME/ASCE/AHS/ASC Structures, Structural Dynamics, and Materials Conference,AIAA,USA,Titan,Titan,Georgia Institute of Technology,NA,N
185,R. E. Dyke,Aeroshell design techniques for aerocapture entry vehicles,2007,Journal,Acta Astronautica,Elsevier,USA,Generic,Generic,NASA Langley Research Center,NA,N
186,T. Kremic,An Overview of NASA's In-Space Propulsion Technology,2007,Conference,AIAA/ASME/SAE/ASEE Joint Propulsion Conference,AIAA,USA,Generic,Generic,NASA Glenn Research Center,NASA,N
187,Z. R. Putnam,Entry System Options for Human Return,2007,Journal,Journal of Spacecraft and Rockets,AIAA,USA,Earth,Earth,Georgia Institute of Technology,NA,Y
188,J. Lee,Fluid-Structure Analysis of a Clamped Ballute in Titan's  atmosphere,2007,Conference,AIAA Computational Fluid Dynamics Conference,AIAA,USA,Titan,Titan,Georgia Institute of Technology,NASA,N
189,G. J. Brown,Inflatable Aerocapture Decelerators for Mars Orbiters,2007,Conference,AIAA Aerodynamic Decelerator Systems Technology Conference,AIAA,USA,Mars,Mars,Vertigo Inc.,NASA,N
190,R. R. Rohrschneider,Survey of Ballute Technology for Aerocapture,2007,Journal,Journal of Spacecraft and Rockets,AIAA,USA,Generic,Generic,Georgia Institute of Technology,NA,N
191,M. Munk,Aerocapture Mission Concepts for Venus, Titan and Neptune,2008,Conference,International Planetary Probe Workshop,IPPW,USA,Generic,Generic,NASA Langley Research Center,NASA,N
192,M. Munk,Aerocapture Technology Development Overview,2008,Conference,IEEE Aerospace Conference,IEEE,USA,Generic,Generic,NASA Langley Research Center,NASA,N
193,M. Munk,Aerocapture Technology Developments by the In Space Propulsion Program,2008,Report,NASA TM,NASA,USA,Generic,Generic,NASA Langley Research Center,NASA,N
194,A. P. Ingersoll,A Neptune Orbiter with Probes Mission with Aerocapture Orbit Insertion,2008,Book Chapter,NASA Space Science Vision Missions,AIAA,USA,Neptune,Neptune,California Institute of Technology,NA,N
195,J. A. Christian,Extension of Traditional Entry, Descent, and Landing Technologies for Human Mars Exploration,2008,Journal,Journal of Spacecraft and Rockets,AIAA,USA,Mars,Mars,Georgia Institute of Technology,NA,N
196,K. L. Gates,Hypersonic Planetary Aeroassist Simulation System Validation,2008,Conference,Aerospace Sciences Meeting,AIAA,USA,Generic,Generic,Global Aerospace Corporation,NA,N
197,R. Armellin,Multidisciplainry Optimization of Aerocapture Maneuvers,2008,Journal,Journal of Artificial Evolution and Applications,Hindawi,Italy,Generic,Generic,Politecnico di Milano,NA,N
198,T. Kremic,NASA’s In-Space Propulsion Technology Project An Overview of Product Status,2008,Conference,AIAA/ASME/SAE/ASEE Joint Propulsion Conference,AIAA,USA,Generic,Generic,NASA Glenn Research Center,NASA,N
199,K. Fujita,Preliminary Study of Venus Exploration with Aerocapture System,2008,Conference,Atmospheric Flight Mechanics Conference,AIAA,Japan,Venus,Venus,Institute of Space and Astronautical Science (ISAS),NA,N
200,J. H. Grinstead,Shock Radiation Measurements for Mars Aerocapture Radiative Heating Analysis,2008,Conference,Aerospace Sciences Meeting,AIAA,USA,Mars,Mars,NASA Ames Research Center,NASA,N
201,L. A. Lemmerman,Small Neptune orbiter using aerocapture,2008,Conference,American Institute of Physics,AIP,USA,Neptune,Neptune,Jet Propulsion Lab,NASA / JPL,N
202,M. K. Lockwood,Titan Explorer,2008,Conference,AIAA/AAS Astrodynamics Conference,AIAA,USA,Titan,Titan,Johns Hopkins University Applied Physics Lab,NA,N
203,J. S. Levine,Titan Explorer The Next Step in the Exploration of a Mysterious World,2008,Book Chapter,NASA Space Science Vision Missions,AIAA,USA,Titan,Titan,NASA Langley Research Center,NA,N
204,J. Melman,Trajectory Optimization for a Mission to Neptune and Triton,2008,Conference,AIAA/AAS Astrodynamics Conference,AIAA,Netherlands,Neptune,Neptune,Delft University of Technology,NA,N
205,M. Munk,Venus - Aerocapture Technology - Presentation to VEXAG,2008,Report,NASA TM,NASA,USA,Venus,Venus,NASA Langley Research Center,NASA,N
206,B. B. Donahue,Ares-V Enabled Titan Sample Return and the Large Space Telescope Missions,2009,Conference,AIAA Space,AIAA,USA,Titan,Titan,Boeing Defense and Space,NA,N
207,D. F. Landau,Comparative Assessment of Human–Mars-mission Technologies and Architectures,2009,Journal,Acta Astronautica,Elsevier,USA,Mars,Mars,Purdue University,NA,N
208,J. S. Robinson,Entry Trajectory and Aeroheating Environment Definition for Capsule-Shaped Vehicles,2009,Journal,Journal of Spacecraft and Rockets,AIAA,USA,Earth,Earth,NASA Langley Research Center,NA,N
209,G. Gelly,Neural Networks as a Guidance Solution for Soft-Landing and Aerocapture,2009,Conference,AIAA Guidance, Navigation, and Control Conference,AIAA,France,Generic,Generic,European Aeronautic and Defense Company,NA,N
210,K. Fujita,Nonstop Mars Sample Return System,2009,Conference,Atmospheric Flight Mechanics Conference,AIAA,Japan,Mars,Mars,Japanese Aerospace and Exploration Agency (JAXA),NA,N
211,J. H. Grinstead,Shock Radiation Measurements for Mars Aerocapture,2009,Journal,Journal of Thermophysics and Heat Transfer,AIAA,USA,Mars,Mars,NASA Ames Research Center,NA,Y
212,D. J. Anderson,Status and Mission Applicability of NASA’s In-Space Propulsion Technology Project,2009,Conference,AIAA/ASME/SAE/ASEE Joint Propulsion Conference,AIAA,USA,Generic,Generic,NASA Glenn Research Center,NASA,N
213,E. Venkatapathy,Thermal protection system development, testing, and qualification for atmospheric probes and SR missions,2009,Journal,Advances in Space Research,Elsevier,USA,Saturn,Saturn,NASA Ames Research Center,NASA,N
214,K. L. Gates,A Dual-Use Lifting Ballute for Orbit Capture and Entry,2010,Conference,AIAA/AAS Astrodynamics Conference,AIAA,USA,Mars,Mars,Global Aerospace Corporation,NA,N
215,K. L. Gates,Aerocapture Ballutes Versus Aerocapture Tethers,2010,Journal,Journal of Spacecraft and Rockets,AIAA,USA,Generic,Generic,Purdue University,NASA,N
216,C. H. Zumwalt,Aerocapture Guidance and Performance at Mars for High-Mass Systems,2010,Conference,AIAA/AAS Astrodynamics Conference,AIAA,USA,Mars,Mars,NASA Johnson Space Center,NA,N
217,J. P. Masciarelli,Demonstration of an Aerocapture GNC System Through Hardware-in-the-Loop Simulations,2010,Conference,AIAA/AAS Astrodynamics Conference,AIAA,USA,Earth,Earth,Ball Aerospace Corp.,NASA,N
218,A. Cassell,Development of Thermal Protection Materials for Future Mars Entry, Descent and Landing Systems,2010,Conference,AIAA/ASME Joint Thermophysics and Heat Transfer Conference,AIAA,USA,Mars,Mars,NASA Ames Research Center,NA,N
219,A. Ciancolo,EDL Systems Analysis Study,2010,Report,NASA TM,NASA,USA,Generic,Generic,NASA Langley Research Center,NASA,N
220,A. Ciancolo,Entry, Descent and Landing Systems Analysis Exploration Class Simulation Overview and Results,2010,Report,AIAA/AAS Astrodynamics Conference,AIAA,USA,Mars,Mars,NASA Langley Research Center,NASA,N
221,T. A. Zang,Overview of the NASA Entry, Descent and Landing Systems Analysis Study,2010,Conference,AIAA Space,AIAA,USA,Mars,Mars,NASA Langley Research Center,NASA,N
222,D. J. Anderson,The NASA In-Space Propulsion Technology Project’s Current Products and Future Directions,2010,Conference,AIAA/ASME/SAE/ASEE Joint Propulsion Conference,AIAA,USA,Generic,Generic,NASA Glenn Research Center,NASA,N
223,E. Venkatapathy,Adaptive Deployable Entry and Placement Technology (ADEPT) - Human Missions to Mars,2011,Conference,AIAA Aerodynamic Decelerator Systems Technology Conference,AIAA,USA,Mars,Mars,NASA Ames Research Center,NASA,N
224,J. Wang,Aerobraking Using Planetary Ionosphere - Electrostatic Augmentation of Aerodynamic Forces,2011,Conference,AIAA/ASME/SAE/ASEE Joint Propulsion Conference,AIAA,USA,Generic,Generic,Virginia Polytechnic Institute,NA,N
225,J. J. Wagner,An adaptive real time atmospheric prediction algorithm for entry vehicles,2011,Conference,Atmospheric Space Environments Conference,AIAA,USA,Mars,Mars,Georgia Institute of Technology,NA,
226,M. K. McGuire,Dual Heat Pulse, Dual Layer Thermal Protection System,2011,Conference,Aerospace Sciences Meeting,AIAA,USA,Mars,Mars,NASA Ames Research Center,NASA,N
227,M. K. McGuire,Flexible Ablative Thermal Protection Sizing on Inflatable,2011,Conference,Aerospace Sciences Meeting,AIAA,USA,Mars,Mars,NASA Ames Research Center,NA,N
228,D. J. Anderson,Propulsion Technology Development for Sample Return Missions under NASA’s ISPT Program,2011,Conference,AIAA/ASME/SAE/ASEE Joint Propulsion Conference,AIAA,USA,Generic,Generic,NASA Glenn Research Center,NASA,N
229,C. Park,Viscous Shock Layer Calculation of Stagnation-Region Heating Environment,2011,Conference,Aerospace Sciences Meeting,AIAA,S. Korea,Neptune,Neptune,Korea Institute of Advanced Science and Technology,NA,N
230,H. Takayanagi,Absolute Radiation Measurements behind Strong Shock Wave for Mars Aerocapture,2012,Conference,Thermophysics Conference,AIAA,Japan,Mars,Mars,Japanese Aerospace and Exploration Agency (JAXA),NA,N
231,T. Ozawa,Analysis of Rarefied Aerodynamic Effects for Mars Entry Missions,2012,Conference,Thermophysics Conference,AIAA,Japan,Mars,Mars,Japanese Aerospace and Exploration Agency (JAXA),NA,N
232,O. B. Bayo,"Study of Feasibility of a Mission to Mars using
Aerocapture Technique",2012,Thesis,BS Thesis,UNIVERSITAT POLITÈCNICA DE CATALUNYA,Spain,Mars,Mars,UNIVERSITAT POLITÈCNICA DE CATALUNYA,NA,N
233,N. Honma,Design Optimization of Aerocapture with Aerodynamic Environment Adaptive Variable Geometry Flexible Aeroshell,2012,Conference,NA,NA,Japan,Mars,Mars,University of Tokyo,Japan Society for Promotion of Sciences,N
234,A. Mafficini,Mars Pre-aerocapture GNC functional and real time performance,2012,Conference,AIAA Guidance, Navigation, and Control Conference,AIAA,Spain,Mars,Mars,DEIMOS Space,NA,N
235,J. Knittel,Multidisciplinary Optimization of Starbody Waverider Shapes for Lifting Aerocapture with Orbital Plane Change,2012,Conference,AIAA/3AF International Space Planes and Hypersonic Systems and Technologies Conference,AIAA,USA,Generic,Generic,University of Maryland, College Park,NASA,N
236,D. J. Anderson,NASA In-Space Propulsion Technologies and Their Infusion,2012,Conference,AIAA/ASME/SAE/ASEE Joint Propulsion Conference,AIAA,USA,Generic,Generic,NASA Glenn Research Center,NASA,N
237,M. Pontani,Post-aerocapture orbit selection and maintenance for the Aerofast mission to Mars,2012,Journal,Acta Astronautica,Elsevier,Italy,Mars,Mars,University of Rome,NA,N
238,K. Fujita,Prediction of Forebody and Aftbody Heat TransferRate for Mars Aerocapture Demonstrator,2012,Conference,Thermophysics Conference,AIAA,Japan,Mars,Mars,Japanese Aerospace and Exploration Agency (JAXA),NA,N
239,D. Prabhu,Atmospheric Entry Studies for Venus Missions,2012,Report,NASA TM,NASA,USA,Venus,Venus,NASA Ames Research Center,NA,N
240,K. Fujita,Conceptual Study of a Small-Sized Mars Aerocapture Demonstrator,2012,Conference,Aerospace Sciences Meeting,AIAA,Japan,Mars,Mars,Japanese Aerospace and Exploration Agency (JAXA),NA,N
241,Kozynchenko,Development of optimal and robust predictive guidance technique for Mars aerocapture,2012,Journal,Aerospace Sciece and Technology,Elsevier,Sweden,Mars,Mars,NA,NA,N
242,Z. R. Putnam,Drag Modulation Flight Control System Options for Planetary Aerocapture,2013,Conference,Aerospace Sciences Meeting,AIAA,USA,Generic,Generic,Georgia Institute of Technology,NASA,N
243,A. Mazzaracchio,Heat Shield Mass Minimization for an Aerocapture Mission to Neptune,2013,Journal,International Journal of Aerospace Innovations,NA,Italy,Neptune,Neptune,University of Rome,NA,N
244,H. Takayanagi,Infrared Radiation Measurement behind Shock Wave in Mars Simulant Gas for Aerocapture Missions,2013,Conference,AIAA Fluid Dynamics,AIAA,Japan,Mars,Mars,Mars,NA,N
245,G. Malucchi,The European Re-entry Program, from IXV to ISV – GNC  Avionics Development Status and Challenges,2013,Conference,AIAA Guidance, Navigation, and Control Conference,AIAA,Italy,Earth,Earth,Thales Alenia Space,NA,N
246,D. Kirley,Plasma Aerocapture and Entry System for Manned Missions and Planetary Deep Space Orbiters,2014,Report,NASA TM,NASA,USA,Generic,Generic,MSNW LLC,NASA,N
247,J. M. Knittel,Concurrent Aerocapture with Orbital Plane Change using Starbody Waveriders,2014,Journal,Journal of Astronautical Sciences,Elsevier,USA,Generic,Generic,University of Maryland, College Park,NA,N
248,Z. R. Putnam,Drag-Modulation Flight-Control System Options,2014,Journal,Journal of Spacecraft and Rockets,AIAA,USA,Generic,Generic,Georgia Institute of Technology,NASA,Y
249,D. J. Anderson,Products from NASA’s in-space propulsion technology program applicable to low-cost planetary missions,2014,Journal,Acta Astronautica,Elsevier,USA,Generic,Generic,NASA Glenn Research Center,NASA,N
250,S. N. D'Souza,Survey of planetary entry guidance algorithms,2014,Journal,Progress in Aerospace Sciences,Elsevier,USA,Generic,Generic,Univeristy of California, Davis,NASA,N
251,C. Park,Viscous Shock-Layer Calculation of Stagnation-Region Heating Environment in Neptune Aerocapture,2014,Journal,Journal of Spacecraft and Rockets,AIAA,S. Korea,Neptune,Neptune,Korea Institute of Advanced Science and Technology,NA,Y
252,P. F. Wercinski,ADEPT - JPL Outer Planets Aerocapture Meeting,2015,Report,NASA TM,NASA,USA,Generic,Generic,NASA Ames Research Center,NASA,N
253,K. M. Hughes,Fast Free Returns to Mars and Venus with Applications to Inspiration Mars,2015,Journal,Journal of Spacecraft and Rockets,AIAA,USA,Mars,Mars,Purdue University,NA,N
254,R. A. Lugo,High Altitude Venus Operations Concept Trajectory Design, Modeling and Simulation,2015,Conference,AIAA/AAS Astrodynamics Conference,AIAA,USA,Venus,Venus,Analytical Mechanics Inc.,NA,N
255,A. Ciancolo,Impact of Utilizing Phobos and Deimos as Waypoints for Mars Human Surface Missions,2015,Conference,AIAA Space,AIAA,USA,Mars,Mars,NASA Langley Research Center,NA,N
256,P. Lu,Optimal Aerocapture Guidance,2015,Conference,AIAA SciTech,AIAA,USA,Generic,Generic,Iowa State University,NASA,N
257,P. Lu,Optimal Aerocapture Guidance,2015,Conference,Journal of Guidance, Control and Dynamics,AIAA,USA,Generic,Generic,Iowa State University,NASA,Y
258,S. Saikia,Aerocapture Assessment at Ice Giants Uranus and Neptune,2016,Report,NASA TM,NASA,USA,Uranus,Uranus,Purdue University,NASA,N
259,S. Saikia,Aerocapture Assessment at Ice Giants Uranus and Neptune,2016,Report,NASA TM,NASA,USA,Neptune,Neptune,Purdue University,NASA,N
260,C. A. Nixon,Aerocapture Design Study for a Titan Polar Orbiter,2016,Report,NASA TM,NASA,USA,Titan,Titan,NASA Goddard Space Flight Center,NA,N
261,S. Feng,A Hybrid Aerocapture Guidance Algorithm,2016,Conference,International Conference on Computer, Mechatronics and Electronic Engineering,NA,China,Earth,Earth,National University of Defense Technology, Changsha,Natural Science Foundation of China,N
262,T. R. Spilker,An Assessment of Aerocapture and Applications to Future Missions,2016,Report,NASA TM,NASA,USA,Venus, Earth, Mars, Titan, Neptune,Generic,Jet Propulsion Lab,NASA,N
263,K. Mall,High Mass Mars Exploration using Slender Entry,2016,Conference,AIAA SciTech,AIAA,USA,Mars,Mars,Purdue University,NA,N
264,Y. Ai,Identifying method of entry and exit conditions for aerocapture with near minimum fuel consumption,2016,Journal,Aerospace Science and Technology,Elsevier,China,Mars,Mars,Harbin Institute of Technology,Natural Science Foundation of China,N
265,C. Jones,High Altitude Venus Operational Concept (HAVOC),2016,Report,NASA TM,NASA,USA,Venus,Venus,NASA Langley Research Center,NA,N
266,B. Wollard,Mechanical Design of a Cubesat Aeroshell for an Earth Demonstration of Drag Modulated Aerocapture,2016,Report,NA,NA,USA,Earth,Earth,Georgia Institute of Technology,NA,N
267,A. Chakrabarthy,Tree Based Trajectory Planning for Mars Aerocapture,2016,Conference,NA,AIAA,USA,Mars,Mars,NASA Ames Research Center,NASA,N
268,K. Webb,Aerocapture Guidance for Human Mars Missions,2017,Conference,AIAA SciTech,AIAA,USA,Mars,Mars,Iowa State University,NASA,N
269,A. Matz,Application of a Fully Numerical Guidance to Mars,2017,Conference,AIAA SciTech,AIAA,USA,Mars,Mars,NASA Johnson Space Center,NA,N
270,J. Williams,Candidate Earth Entry Trajectories to Mimic Venus Aerocapture,2017,Report,NASA TM,NASA,USA,Venus,Venus,University of Illinois,NA,N
271,J. Elliot,Ice Giants Pre Decadal Mission Study Full-Report – Uranus,2017,Report,NASA TM,NASA,USA,Uranus,Uranus,Jet Propulsion Lab,NASA,N
272,J. Elliot,Ice Giants Pre Decadal Mission Study Full-Report – Neptune,2017,Report,NASA TM,NASA,USA,Neptune,Neptune,Jet Propulsion Lab,NASA,N
